	PMCID	id	sectype	sentenceid	text
573	6141466	BODY16	CONCLUSIONS	134	Results from our study suggest that activation of canonical WNT signaling leads to chemotherapy resistance in SCLC—a finding that has not been previously reported to the best of our knowledge.
574	6141466	BODY16	CONCLUSIONS	135	WNT activation is likely to drive treatment resistance through its effects on apoptosis, DNA repair, expression of drug efflux pumps, cell differentiation, and/or by facilitating immune evasion30,31,36,37.
575	6141466	BODY16	CONCLUSIONS	136	We noted alterations in multiple genes that participate in WNT signaling among relapsed tumors, independent of the presence of APC or CHD8 alterations.
576	6141466	BODY16	CONCLUSIONS	137	Similar findings were reported for colorectal cancer by The Cancer Genome Atlas, where tumors harboring APC mutations were also found to harbor other WNT pathway alterations38.
577	6141466	BODY16	CONCLUSIONS	138	While the biological significance of cancer cells acquiring multiple alterations in the same pathway is unclear and may seem counterintuitive, it is possible that tumor cells select for these alterations to achieve an optimal level of WNT signaling39.
578	6141466	BODY16	CONCLUSIONS	139	On the other hand, these alterations could be confined to different subclones within the tumor and represent various mechanisms through which cancer cells activate WNT signaling.
579	6141466	BODY16	CONCLUSIONS	140	We also observed LoH in negative regulators of canonical WNT signaling such as APC and CSNK1A1 in nearly two-thirds of relapse SCLC samples.
580	6141466	BODY16	CONCLUSIONS	141	In conjunction with the high ssGSEA scores for WNT activation among relapse samples, this observation demonstrates that WNT signaling genes are likely to be altered through mechanisms other than non-synonymous mutations, which WES alone is unable to detect.
581	6141466	BODY16	CONCLUSIONS	142	Furthermore, components of the WNT signaling pathway are promiscuous in their interactions and demonstrate a great degree of overlap with other pathways.
582	6141466	BODY16	CONCLUSIONS	143	Therefore, molecular studies of how alterations in WNT signaling affect the net activation of different pathways and a comprehensive analysis of the clonal architecture of tumors employing ultra-deep or single-cell sequencing techniques is likely to shed more light on the precise mechanisms of drug resistance in SCLC.
583	6141466	BODY17	CONCLUSIONS	144	A recent study reported by Gardner et al. utilizing human SCLC patient-derived xenografts (PDXs) failed to observe mutational differences between treatment-naive and relapsed SCLCs40.
584	6141466	BODY17	CONCLUSIONS	145	EZH2-mediated epigenetic reprogramming that led to the silencing of SLFN11 was identified as the mechanism driving induced chemotherapy resistance in this study—a finding which we were unable to reproduce, possibly due to a lack of paired primary-relapse gene expression data.
585	6141466	BODY17	CONCLUSIONS	146	Interestingly, another recent analysis by Drapkin et al., reported an association between increased expression of a MYC gene signature and chemotherapy resistance in SCLC PDXs derived from biopsy samples and circulating tumor cells, but failed to observe a correlation between SLFN11 expression and chemotherapy sensitivity41.
586	6141466	BODY17	CONCLUSIONS	147	Heterogeneity in mechanisms that drive chemotherapy resistance in SCLC, sample characteristics, and differences in experimental design are likely factors contributing to the observed discrepancies between studies.
587	6141466	BODY17	CONCLUSIONS	148	For instance, since chemotherapy is known to affect immunogenic cell death in cancer cells and WNT signaling plays an important role in shaping tumor-host immune interactions, the utilization of immunodeficient mice for generating PDXs could have influenced the selection pressures acting on grafted tumors following exposure to chemotherapy in these studies31,42.
588	6141466	BODY18	CONCLUSIONS	149	To the best of our knowledge, this is the first study to perform comprehensive molecular characterization of paired human SCLC samples obtained at diagnosis and relapse.
589	6141466	BODY18	CONCLUSIONS	150	We acknowledge the limitations of our study, particularly with regard to small sample size, limited number of matched treatment-naive samples, and lack of RNA-sequencing data from treatment-naive samples.
590	6141466	BODY18	CONCLUSIONS	151	While these factors limit our ability to perform a number of additional informative analyses (e.g., tumor/relapse paired CTNNB1 immunohistochemistry), it is extremely important to consider that patients with relapsed SCLC rarely undergo biopsies that yield enough tissue for high throughput sequencing. Our ability to demonstrate WNT pathway mutations and activation in relapse SCLC samples, and to validate their role in mediating chemotherapy resistance in vitro provide a rationale for studying WNT signaling inhibitors to overcome treatment resistance in SCLC.
591	6141466	BODY19	METHODS	152	Tumor specimens for whole exome and transcriptome sequencing were obtained from patients diagnosed with SCLC who were treated at the Alvin J Siteman Cancer Center at Washington University School of Medicine.
592	6141466	BODY19	METHODS	153	The Human Research Protection Office (HRPO) at the Washington University School of Medicine approved the study.
593	6141466	BODY19	METHODS	154	All patients provided informed consent for participation and underwent a biopsy at the time of relapse and pre-treatment biopsy specimens were obtained for the twelve patients for whom a corresponding primary was available.
594	6141466	BODY19	METHODS	155	Pathological diagnosis was confirmed by independent review by two pathologists (authors CJO and JHR; images available as Supplementary Data).
595	6141466	BODY19	METHODS	156	Tumor specimens from multiple metastatic sites at relapse were available for two patients.
596	6141466	BODY19	METHODS	157	For these patients, we also identified a single representative sample based upon observed VAFs for called mutations among all specimens from that patient.
597	6141466	BODY19	METHODS	158	These representative samples were used in cohort-level analyses to maintain biological independence among tested samples in the cohort.
598	6141466	BODY19	METHODS	159	Peripheral blood was used for germline analysis for all patients.
599	6141466	BODY19	METHODS	160	Tissues were assigned a code and banked.
600	6141466	BODY19	METHODS	161	Patient consenting, sample and data collection and storage were all conducted in compliance with institutional ethical regulations.
601	6141466	BODY20	METHODS	162	DNA and RNA extractions were performed using Qiagen kits.
602	6141466	BODY20	METHODS	163	The DNeasy Blood and Tissue kit was used for DNA isolation from flash frozen (FF) materials.
603	6141466	BODY20	METHODS	164	The QIAamp DNA FFPE Tissue or QIAamp DNA Mini kit was used for DNA isolation from FFPE materials.
604	6141466	BODY20	METHODS	165	The RNeasy Mini kit was used for RNA isolation from FF materials.
605	6141466	BODY21	METHODS	166	Specimens were prepared in several batches (work orders) over the course of the study.
606	6141466	BODY21	METHODS	167	Reference Supplementary Tables Sample Work Orders (Supplementary table 8) and Work Order Details (Supplementary table 9) for kits used for library construction and capture methods applied to each sample.
607	6141466	BODY21	METHODS	168	Specimens were pooled together pre-capture, 400 ng/sample for a 1.6 μg input for capture.
608	6141466	BODY21	METHODS	169	Each pool was sequenced over two lanes of an Illumina HiSeq sequencing instrument.
609	6141466	BODY22	METHODS	170	All genomic analyses were managed with the Genome Modeling System (GMS)43. Exome sequencing data were aligned to the human reference genome build GRCh37 using bwamem version 0.7.10 with default parameters44.
610	6141466	BODY22	METHODS	171	Exome alignment models were processed by the GMS Somatic variation pipeline to identify single-nucleotide variants (SNVs), insertions and deletions (indels), and copy number alterations (CNAs)43. The union of snv/indel variant calls for each sample were manually reviewed using IGV45 (Supplementary table 10).
611	6141466	BODY22	METHODS	172	Somatic SNV detection was performed in this pipeline using a combination of SomaticSniper (version 1.0.2)46, VarScan (version 2.3.6)47, and Strelka (1.0.11)48.
612	6141466	BODY22	METHODS	173	Somatic small indels were detected by a combination of GATK Somatic Indel Detector (version 5336)49, Pindel (version 0.5)50, VarScan, and Strelka.
613	6141466	BODY22	METHODS	174	Annotation of variants was performed using the GMS transcript variant annotator against a GMS “annotation” build based on Ensembl v74_37 transcripts.
614	6141466	BODY22	METHODS	175	SNVs and INDELs were further filtered by removing artifacts found in a panel of 905 normal exomes51, removing sites that exceeded 0.1% frequency in the ExAC cohort release v0.252, and then using a bayesian classifier (https://github.com/genome/genome/blob/master/lib/perl/Genome/Model/Tools/Validation/IdentifyOutliers.pm) and retaining variants classified as somatic with a binomial log-likelihood of at least 10 (params: -llr-cutoff 10).
615	6141466	BODY22	METHODS	176	Finally, these filtered mutations then underwent manual review with IGV.
616	6141466	BODY23	METHODS	177	Variant allele frequencies were analyzed using SciClone 1.0.7 to visualize clonality53.
617	6141466	BODY23	METHODS	178	Variants were visualized and compared with an ad hoc R script, available on the paper methods repository for this manuscript (https://github.com/ahwagner/sclc).
618	6141466	BODY24	METHODS	179	Mutation signatures were calculated using the deconstructSigs R package10.
619	6141466	BODY24	METHODS	180	The signatures evaluated were the 30 COSMIC signatures for mutational processes in human cancers (http://cancer.sanger.ac.uk/cosmic/signatures).
620	6141466	BODY24	METHODS	181	A difference of indel counts between limited and extensive stage samples (Supplementary table 1) was tested by unpaired t- test.
621	6141466	BODY25	METHODS	182	SMGs in relapsed samples were identified using MuSiC v0.413.
622	6141466	BODY25	METHODS	183	The region of interest file was created using regions annotated as CDS or RNA in Ensembl v74 with 2 bp flank added to contiguous exons in order to retain splice sites.
623	6141466	BODY25	METHODS	184	Only relapse and normal samples were used for analysis.
624	6141466	BODY25	METHODS	185	For individuals with multiple relapse samples, variants from all relapse samples for that individual were merged, deduplicated and used for analysis.
625	6141466	BODY25	METHODS	186	A representative BAM file was also used for coverage calculations for these individuals.
626	6141466	BODY25	METHODS	187	The “-merge-concurrent-muts” option was applied, allowing a single individual to only contribute, at most, a single mutation to the total mutation burden of any one gene.
627	6141466	BODY25	METHODS	188	All other default parameters were used.
628	6141466	BODY25	METHODS	189	The FDR cutoff was based on the convolution test (CT) method.
629	6141466	BODY26	METHODS	190	Segmentation files and marker files were generated for each sample using existing loss-of-heterozygosity data from genotyping arrays and the correct format was verified by comparison to the example data provided by the documentation.
630	6141466	BODY26	METHODS	191	Using these files as input, GISTIC 2.016 was run using the GenePattern web module to call copy number alterations and evaluate cohort recurrence for significantly altered regions (https://genepattern.broadinstitute.org/gp).
631	6141466	BODY26	METHODS	192	The supplied hg19 build of the reference genome was used.
632	6141466	BODY26	METHODS	193	A germline CNA file was not provided.
633	6141466	BODY26	METHODS	194	Default parameters were used for all sections under Additional Parameters and Advanced Parameters.
634	6141466	BODY26	METHODS	195	Output file significant calls were verified by manual review using original BAM files in IGV.
635	6141466	BODY27	METHODS	196	Heterozygous germline variant calls were selected from each patient sample where the normal VAF was within the range of 40–60.
636	6141466	BODY27	METHODS	197	Absolute difference between the tumor VAF and 50 was calculated to produce a zygosity score.
637	6141466	BODY27	METHODS	198	Segments were generated using the DNAcopy54 circular binary segmentation algorithm, and average zygosity score of constituent variants attributed to the segments.
638	6141466	BODY27	METHODS	199	Biomart55 was used to obtain genomic coordinates for each gene and overlap with the segment coordinates, to generate a zygosity score for each gene in each sample.
639	6141466	BODY27	METHODS	200	A zygosity score above 30 (representing an average tumor VAF < 20 or >80) was used to call a gene as loss-of-heterozygosity (LoH) (Supplementary table 11).
640	6141466	BODY27	METHODS	201	In cases where there was insufficient data to make a segment, the zygosity score was omitted, and no LoH call was made.
641	6141466	BODY28	METHODS	202	Cancer relevant genes were collected from Supplementary table 2 of Lawrence et al., and filtered for a pan-cancer q value < = 0.1, as discussed in the main text of that paper (list of genes available in Supplementary table 6).
642	6141466	BODY28	METHODS	203	A list of genes participating in canonical WNT signaling was curated from Reactome (Supplementary table 7) after analyzing WNT gene lists R-HSA195721 (Signaling by WNT) and R-HSA-3858494 (β-catenin independent WNT signaling).
643	6141466	BODY29	METHODS	204	Fasta files were trimmed using Flexbar56 with settings: -adapter-min-overlap 7 -min-read-length 20 to improve read alignments.
644	6141466	BODY29	METHODS	205	Reads were aligned by hisat2.0.557 using Ensembl version 74 transcripts.
645	6141466	BODY29	METHODS	206	Reads were sorted and indexed by SAMtools 1.3.158 and then used for expression estimation by Stringtie 1.3.359.
646	6141466	BODY30	METHODS	207	Stringtie expression estimates were loaded by Ballgown60, expression filtered, log transformed, normalized by ComBat61, and clustered with pheatmap (https://github.com/raivokolde/pheatmap) in an ad hoc script available on the methods repository for this manuscript (https://github.com/ahwagner/sclc).
647	6141466	BODY31	METHODS	208	Expression estimates were combined with human primary tumor expression data from George et al.3.
648	6141466	BODY31	METHODS	209	Data were then manually transformed into a GCT file:
649	6141466	BODY32	METHODS	210	(http://software.broadinstitute.org/cancer/software/genepattern/file-formats-guide#_Creating_Input_Files_Tab) and run through ssGSEA v9.0.6 in GenePattern (https://genepattern.broadinstitute.org).
650	6141466	BODY32	METHODS	211	Relevant gene sets were selected from MutSigDB (http://software.broadinstitute.org/gsea/msigdb/genesets.jsp) and downloaded as GMT files.
651	6141466	BODY32	METHODS	212	The input and result files (Supplementary table 12) of this analysis are available on the methods repository for this manuscript (https://github.com/ahwagner/sclc).
652	6141466	BODY33	METHODS	213	ssGSEA was validated by calculating ssGSEA enrichment scores using an ASCL1 expression signature (as defined by Borromeo et al. )5, and exploring the correlation between ASCL1 enrichment and tumor subtype (ASCL1-high [A], NEUROD1-high [N], and Dual negative [D]).
653	6141466	BODY33	METHODS	214	Subtype information for George et al. treatment-naive samples was obtained from the publication by Mollaoglu et al.6 Finally, independently categorized samples were grouped together by subtype for this analysis, to test the ability of ssGSEA to detect true biological differences independent of batch effect.
654	6141466	BODY33	METHODS	215	As expected, ASCL1 high tumors from both studies were most enriched for the ASCL1 signature, while dual negatives were the least enriched (one-way ANOVA analysis; p < 0.0001).
655	6141466	BODY33	METHODS	216	Similarly, analyses by Mollaoglu et al. and Polley et al. demonstrated high MYC activity in ASCL1-low SCLC samples and cell lines6,62.
656	6141466	BODY33	METHODS	217	Using the ssGSEA method, we calculated enrichment scores for MYC activation (using the MYC activation signature defined by Bild et al.) and ASCL1 driven gene expression (defined by Borromeo et al.) and examined their correlation5,62.
657	6141466	BODY33	METHODS	218	Once again, independently subtyped SCLC samples were grouped together for this analysis.
658	6141466	BODY33	METHODS	219	As expected, MYC activation was inversely correlated with high ASCL1 enrichment scores (linear regression; p = 0.003).
659	6141466	BODY34	METHODS	220	PrimerSequenceH82, DMS53, and H1048 cell line experiments sgControl FwdCACCGGCGAGGTATTCGGCTCCGCG sgControl RevAAACCGCGGAGCCGAATACCTCGCC Human sgAPC FwdCACCGGTTTGAGCTGTTTGAGGAGG Human sgAPC RevAAACCCTCCTCAAACAGCTCAAACC Actin FwdTATTGGCAACGAGCGGTTCC Actin RevGGCATAGAGGTCTTTACGGATGTC AXIN2 FwdGCCAAGTGTCTCTACCTCATT AXIN2 RevTTTCCAGCCTCGAGATCA APC FwdCAGATTCTGCTAATACCCTGCAA APC RevCCATCTGGAGTACTTTCCGTG H1694 cell line experiments AXIN2 Fwd-2CGGACAGCAGTGTAGATGGA AXIN2 Rev-2CTTCACACTGCGATGCATTT
660	6141466	BODY35	METHODS	221	NCI-H1048 and DMS53 cells (kindly provided by David MacPherson) were maintained in RPMI.
661	6141466	BODY35	METHODS	222	H82 cells were obtained from ATCC and maintained in RPMI.
662	6141466	BODY35	METHODS	223	All medias contained 10% FBS, 1% Pen/Strep and 1% l-glutamine.
663	6141466	BODY35	METHODS	224	Cell lines were validated by STR profiling at the University of Utah DNA Sequencing Core Facility using the GenePrint 24 kit from Promega (Madison, WI, USA) in June and December 2017.
664	6141466	BODY35	METHODS	225	Chemotherapy resistant clones of these cell lines were derived from parental lines through repeated in vitro cisplatin and etoposide treatment followed by serial passaging.
665	6141466	BODY35	METHODS	226	Targeted Sanger sequencing of APC was performed on these lines.
666	6141466	BODY36	METHODS	227	For generating viral supernatants, 293T cells were transfected using Mirus LT-1 transfection reagent with gene plasmids as indicated along with Gag/pol and Env plasmids.
667	6141466	BODY36	METHODS	228	Supernatants were harvested after 48–72 h and cell lines were infected twice with viral supernatant at 1:1 (media/supernatant) with 1000× polybrene (8 μg/ml).
668	6141466	BODY36	METHODS	229	Cells were then selected for 2–3 days in puromycin.
669	6141466	BODY37	METHODS	230	Validated human APC sgRNA63 and sgControl primers were subcloned into Lenti-CRISPR-V264 (Addgene plasmid #52961).
670	6141466	BODY37	METHODS	231	H82 cells were infected with Lenti-V2-sgAPC or sgControl lentivirus and stable polyclonal pools were selected with puromycin.
671	6141466	BODY38	METHODS	232	For gene expression analysis by real-time PCR, RNA was isolated by TRIzol from Invitrogen (Carlsbad, CA, USA) or RNeasy kit from Qiagen (Hilden, Germany) and 1 μg of total RNA was converted to cDNA using iScript cDNA synthesis kit from Bio-Rad (Hercules, CA, USA).
672	6141466	BODY38	METHODS	233	Quantitative real-time PCR was performed using gene-specific primers and Sybr Green Supermix (Bio-Rad) in a 20 μl reaction in triplicate on a Bio-Rad CFX96 Real-Time PCR machine.
673	6141466	BODY38	METHODS	234	Analysis was performed using Bio-Rad CFX Manager software and expression values were based on 10-fold serial dilutions of standards and normalized to Actin levels.
674	6141466	BODY38	METHODS	235	Actin Fwd and Rev, and AXIN2 Fwd and Rev primers were used for real-time PCR.
675	6141466	BODY39	METHODS	236	Cells were seeded in triplicate (5000/well) in opaque 96-well plates.
676	6141466	BODY39	METHODS	237	The next day, cells were treated with increasing doses of cisplatin (0–100 μM), or etoposide (0–100 μM) obtained from Sigma (St. Louis, MO, USA).
677	6141466	BODY39	METHODS	238	After 48–96 h of treatment, cell viability was measured using CellTiter Glo from Promega (Madison, WI, USA) on a luminometer.
678	6141466	BODY39	METHODS	239	Normalized, transformed dose response curves were generated and analyzed using GraphPad Prism (GraphPad Software Inc.; LaJolla, CA, USA) to determine IC50.
679	6141466	BODY40	METHODS	240	Total protein lysates or nuclear and cytoplasmic fractions were separated via SDS-PAGE and transferred to a PVDF membrane.
680	6141466	BODY40	METHODS	241	Membranes were blocked for 1 h, followed by overnight incubation with primary antibodies from Cell Signaling Technologies (Danvers, MA, USA): B-Catenin (9587S, Carboxy terminal antigen) or PARP (46D11) at 1:1000 dilution, B-Tubulin (Developmental Studies Hybridoma Bank, 1:200) or Beta-Actin (#A2066, 1:10,000) from Sigma-Aldrich (St. Louis, MO, USA) at 4 °C.
681	6141466	BODY40	METHODS	242	Membranes were washed at room temperature in TBS-T.
682	6141466	BODY40	METHODS	243	Mouse or rabbit HRP-conjugated secondary antibodies from Jackson ImmunoResearch (West Grove, PA, USA) at 1:10,000 dilution were incubated for 1 h at room temperature.
683	6141466	BODY40	METHODS	244	For detection, membranes were exposed to WesternBright HRP Quantum substrate from Advansta (Menlo Park, CA, USA) and detected on Hyblot CL film from Denville Scientific Inc. (Holliston, MA, USA).
684	6141466	BODY40	METHODS	245	Uncropped blots are available in Supplementary Information (Supplementary fig. 6).
685	6141466	BODY41	METHODS	246	Genomic DNA was isolated from snap-frozen cell pellets with the DNeasy kit from Qiagen.
686	6141466	BODY41	METHODS	247	Human APC PCR products were amplified with APC Fwd and APC Rev primers.
687	6141466	BODY41	METHODS	248	sgRNA-induced alterations were detected with the IDT Surveyor Mutation Detection Kit (Integrated DNA Technologies, Coralville, IA, USA; #706030) following the manufacturer’s specifications.
688	6141466	BODY41	METHODS	249	Amplified APC PCR products were subcloned into TOPO vectors from Life Technologies (Carlsbad, CA, USA) and individual colonies were sequenced to identify APC alterations.
689	6141466	BODY42	METHODS	250	RNA was extracted from cells using RNeasy Kit from Qiagen.
690	6141466	BODY42	METHODS	251	The RNA-seq libraries were generated using Illumina TruSeq Stranded mRNA sample preparation kit with oligo dT selection.
691	6141466	BODY42	METHODS	252	Sequencing libraries (25 pM) were chemically denatured and applied to an Illumina HiSeq v4 paired end flow cell using an Illumina cBot.
692	6141466	BODY42	METHODS	253	Hybridized molecules were clonally amplified and annealed to sequencing primers with reagents from an Illumina HiSeq PE Cluster Kit v4-cBot.
693	6141466	BODY42	METHODS	254	Following transfer of the flowcell to an Illumina HiSeq instrument at the University of Utah High-Throughput Genomics Core, a 125 cycle paired-end sequence run was performed using HiSeq SBS Kit v4 sequencing reagents with six samples multiplexed in each Illumina lane.
694	6141466	BODY42	METHODS	255	The average number of reads per sample ranged from 38 to 58 million reads.
695	6141466	BODY43	METHODS	256	Gene expression was determined using the RSEM utility “rsem-calculate-expression” using the stranded and paired-end options.
696	6141466	BODY43	METHODS	257	Differential expression was determined using EBSeq (v1.4.0) using “MedianNorm” function to calculate size factors and setting “maxround” to 10 (ref. 55).
697	6141466	BODY43	METHODS	258	For hierarchical clustering based on sample distances, counts were loaded into the edgeR (v3.8.5) DGEList object.
698	6141466	BODY43	METHODS	259	Genes with counts-per-million (cpm) greater than 2 in at least two samples were kept.
699	6141466	BODY43	METHODS	260	Counts were normalized using the edgeR calcNormFactors method with default settings.
700	6141466	BODY43	METHODS	261	A matrix of log2 cpm values was generated using the edgeR function predFC setting prior.count to 2.
701	6141466	BODY43	METHODS	262	The Euclidean distances calculated using the transposed log2cpm matrix were run through heatmap.2 using default settings.
702	6141466	BODY43	METHODS	263	Differentially expressed genes (FC > 1.5 or 2, FDR < 0.05) were analyzed for enrichment of pathways, tissue expression and biological processes using QIAGEN’s Ingenuity Pathway Analysis (IPA, QIAGEN).
703	6141466	BODY44	METHODS	264	Small cell lung cancer cell line NCI-H1694 was a gift from the Oliver lab (author TO).
704	6141466	BODY44	METHODS	265	STR testing was performed in the Oliver lab to verify cell line identity.
705	6141466	BODY44	METHODS	266	Cell lines were maintained in RPMI 1640 media supplemented with 10% FBS.
706	6141466	BODY44	METHODS	267	Cells were maintained at 37 °C in 5% CO2.
707	6141466	BODY44	METHODS	268	For lentiviral production, 5 × 106 293T cells were co-transfected with pCMV-VSV-G, pCMVΔR8.2, and pLKO.1-puro constructs using Lipofectamine 2000 from ThermoFisher (Waltham, MA, USA).
708	6141466	BODY44	METHODS	269	Forty-eight hours post transfection, viral supernatants were collected and pooled.
709	6141466	BODY44	METHODS	270	NCI-H1694 cells were incubated with viral supernatant for 24 h, in the presence of polybrene (10≥μg/mL).
710	6141466	BODY44	METHODS	271	Cells were then selected with puromycin for 48 h.
711	6141466	BODY45	METHODS	272	APC (NM_000038.2) knockdown was performed using pLKO.1-shRNA constructs obtained from the McDonnell Genome Institute at Washington University.
712	6141466	BODY45	METHODS	273	At least two shRNAs targeting APC at different locations were utilized in each knockdown experiment.
713	6141466	BODY45	METHODS	274	shRNA construct #1 (seed sequence: CCCAGTTTGTTTCTCAAGAAA) targeted positions 6136–6156 in exon 16 (NM_000038.5), while #2 (seed sequence: TAATGAACACTACAGATAGAA) targeted nucleotides 8921–8941 in the 3′ UTR (mRNA transcript number NM_000038.5 in both instances).
