	PMCID	id	sectype	sentenceid	text
1243	8936524	BODY53	RESULTS	188	At day 10 of GSK690 treatment, a larger number of genes show changes in all four sensitive cell lines, with the majority of genes showing upregulation (FDR < 0.05, fold change ≥ 2) (Fig. 4B).
1244	8936524	BODY53	RESULTS	189	Interestingly, only five genes and 43 genes were significantly altered after 10 days of GSK690 treatment in two GSK690‐insensitive models, NCI‐H82 and NCI‐H1694, respectively (Fig. 4B).
1245	8936524	BODY53	RESULTS	190	Evaluation of common transcriptional changes occurring in sensitive models revealed only seven genes as consistently altered (FDR < 0.05, fold change ≥ 2) in expression at day 10 in all four cells lines (Fig. 4C).
1246	8936524	BODY53	RESULTS	191	However, the data showed more convergence at a pathway level with several common pathways identified showing consistent changes due to GSK690 treatment in the four sensitive cell lines.
1247	8936524	BODY53	RESULTS	192	Pathways associated with genes upregulated by GSK690 treatment are enrichment in epithelial–mesenchymal transition pathway, TGF‐beta signaling, NOTCH signaling, and focal adhesion‐related signaling consistent with the observed changes in adhesion (Fig. 4D, Fig. S4C).
1248	8936524	BODY53	RESULTS	193	Conversely, pathways enriched in genes downregulated by GSK690 treatment did not show overlap between different cell lines and include various signaling pathways (Fig. 4D, Fig. S4C).
1249	8936524	BODY54	RESULTS	194	Changes in neuroendocrine and mesenchymal markers were also observed at the protein level in GSK690‐sensitive cell models (Fig. S6).
1250	8936524	BODY54	RESULTS	195	COR‐L88 cells showed the strongest shift into a mesenchymal‐like state showing downregulation of neuroendocrine proteins NSE, GRP, NCAM, and CHGA and neuroendocrine transcription factors FOXA2, ASCL1, and SOX2.
1251	8936524	BODY54	RESULTS	196	COR‐L88 cells also showed strong upregulation of the mesenchymal protein VIM.
1252	8936524	BODY54	RESULTS	197	Other GSK690‐sensitive cell models showed only small changes in protein levels across our panel with GRP reduction and ZEB1 and CDH2 upregulation being the most consistent markers of response (Fig. S6).
1253	8936524	BODY54	RESULTS	198	We observed no consistent changes in the protein levels of any neuroendocrine and mesenchymal markers in GSK690‐insensitive cell lines.
1254	8936524	BODY54	RESULTS	199	Importantly, the extent of mesenchymal gene induction in GSK690‐treated SCLC cells does appear comparatively lower relative to what we observed in mesenchymal‐shifted NCI‐H69V cells and thus may represent a ‘partial EMT’ [47].
1255	8936524	BODY55	RESULTS	200	To define the origin of mesenchymal‐like persister cells, we conducted single cell RNA‐seq analysis on NCI‐H69 cells treated with DMSO or 0.3 μm GSK690 for 21 days.
1256	8936524	BODY55	RESULTS	201	Harmony [31] was applied to integrate DMSO and treatment groups so that gene expression within each single cell subpopulation can be directly compared with obtain subpopulation‐specific differentially expressed (DE) genes after treatment (Fig. 5A).
1257	8936524	BODY55	RESULTS	202	To identify distinct cell subpopulations, unsupervised cell clustering was performed and five clusters were selected manually after visualization using uniform manifold approximation and projection (UMAP) (Fig. 5B and Fig. S7A).
1258	8936524	BODY55	RESULTS	203	Cell subpopulations in Clusters 0 and 3 were increased in 0.3 μm GSK690‐treated group relative to the DMSO group (Fig. S7A).
1259	8936524	BODY55	RESULTS	204	In contrast, cell subpopulations in Clusters 1 and 2 in DMSO group were reduced after 21 days of LSD1 inhibitor treatment (Fig. S7A).
1260	8936524	BODY55	RESULTS	205	There was no significant difference in the Cluster 4 cell subpopulation between DMSO and treated groups.
1261	8936524	BODY55	RESULTS	206	Cluster 2 was identified as a neuroendocrine‐like subpopulation, as neuroendocrine transcriptional factors GRP and ASCL1 were specifically upregulated in this subpopulation (Fig. 5B and Fig. S8A).
1262	8936524	BODY55	RESULTS	207	Both GRP expression and ASCL1 expression were strongly reduced in Cluster 2 after treatment (Fig. S7B).
1263	8936524	BODY55	RESULTS	208	In addition, the mean expression of neuroendocrine markers (NE score) including ASCL1, CHGA, GRP, INSM1, NCAM1, FOXA2, and SOX2 was significantly reduced in Cluster 2 after treatment (Fig. 5C, left), suggesting cells in this cluster are losing NE features.
1264	8936524	BODY55	RESULTS	209	On the other hand, the mean expression of 76 EMT marker genes from the Broad MSigDB Hallmark Signatures (EMT score) was upregulated in multiple cell clusters after treatment, but most significantly increased in Cluster 0 (Fig. 5C, right).
1265	8936524	BODY55	RESULTS	210	This observation is supported by the significant upregulation of EMT and lung cancer survival pathways in Cluster 0 after treatment (Fig. S8B).
1266	8936524	BODY55	RESULTS	211	Altogether, these results highlight the loss of NE cell subpopulation and the emergence of several transcriptionally distinct, mesenchymal‐like populations in NCI‐H69 cells resistant to LSD1 inhibitors.
1267	8936524	BODY57	RESULTS	212	In an attempt to assess the reversibility of the mesenchymal shift observed in LSD1 inhibitor persister cells, we performed drug washout experiments.
1268	8936524	BODY57	RESULTS	213	After 14 days of GSK690 treatment in NCI‐H526 and NCI‐H69 cells, antiproliferative effects occurred concomitant with the upregulation of mesenchymal markers CDH2, SNA1, MYC, VIM, and ZEB1 and the downregulation of neuroendocrine markers GRP, ASCL1, and CHGA (Fig. S9).
1269	8936524	BODY57	RESULTS	214	After 7 days of drug washout, gene expression signatures recovered in both cell lines to levels similar to that observed in DMSO controls.
1270	8936524	BODY57	RESULTS	215	Moreover, after 7 days of drug washout, cells regained sensitivity to LSD1 inhibition to a similar extent as untreated cell lines (Fig. S9).
1271	8936524	BODY57	RESULTS	216	These data suggest that the mesenchymal shift in SCLC cells treated with LSD1 inhibitors is reversible and caused by an ‘epi‐stable’ mesenchymal‐like differentiation state.
1272	8936524	BODY58	RESULTS	217	We next sought to define the extent of epigenetic reprogramming in LSD1 inhibitor drug‐tolerant cells by employing an assay for transposase‐accessible chromatin using sequencing (ATAC‐seq).
1273	8936524	BODY58	RESULTS	218	ATAC‐seq data in NCI‐H69 cells treated with 0.3 μm GSK690 for 21 days were highly reproducible between biological replicates and showed clear enrichment at specific genomic regions (Fig. S10A).
1274	8936524	BODY58	RESULTS	219	Consistent with observed changes in gene expression, differentially open or closed chromatin accessibility peaks were primarily identified at distal regulatory regions of genes after 21 days of GSK690 treatment compared with controls (Fig. 6A, Fig. S10B).
1275	8936524	BODY58	RESULTS	220	GREAT gene ontology analysis [39] for genes acquiring open chromatin accessibility peaks near regulatory regions suggests enrichment in pathways involved in mesenchyme morphogenesis and regulation of epithelial cell differentiation (Fig. 6B).
1276	8936524	BODY58	RESULTS	221	In contrast, genes that acquire closed chromatin do not show any significant pathway enrichment.
1277	8936524	BODY60	RESULTS	222	To study the transcription factor programs regulating drug‐resistant SCLC cells, we identified the transcription factor motifs represented in differentially accessible, closed or open, chromatin regions after GSK690 treatment (Fig. 6C,D).
1278	8936524	BODY60	RESULTS	223	We used chromvar [40], a package designed for inferring transcription factor activity from ATAC‐seq based on chromatin accessibility levels at TF binding motifs genome‐wide (Fig. 6C,D).
1279	8936524	BODY60	RESULTS	224	Our analysis demonstrated that NEUROD1/NEUROD2 and ASCL1 DNA binding motifs were significantly closed following GSK690 treatment.
1280	8936524	BODY60	RESULTS	225	The DNA binding motif for TEAD4 is the only significantly opened region with the treatment (Fig. 6C,D).
1281	8936524	BODY60	RESULTS	226	TEAD4 is a downstream mediator of YAP1 activity, which has been previously identified as a possible phenotypic modulator in a subset of non‐neuroendocrine SCLC cell lines [48].
1282	8936524	BODY60	RESULTS	227	A small molecule, TED‐347, was recently discovered to demonstrate covalent engagement of cysteine to inhibit TEAD4·YAP1 protein–protein interaction and block TEAD transcriptional activity [49].
1283	8936524	BODY60	RESULTS	228	We treated NCI‐H69 cells with either LSD1 inhibitor GSK690 or combination with TED‐347 for 21 days.
1284	8936524	BODY60	RESULTS	229	Combination treatment with TED‐347 significantly prevented the cell regrowth following the drug withdrawal for up to 21 days (Fig. 6E).
1285	8936524	BODY60	RESULTS	230	Thus, inhibiting TEAD transcriptional activity prevents the acquired resistance of SCLC in response to LSD1 inhibitors.
1286	8936524	BODY60	RESULTS	231	These data indicate that mesenchymal‐like drug tolerance in SCLC cell lines occurs through epigenetic reprogramming mediated through changes in transcription factor programs driven by oncogenic YAP signaling.
1287	8936524	BODY61	CONCLUSIONS	232	In this study, we have identified common features of intrinsic and acquired drug resistance to LSD1 inhibitors through epigenetic changes in SCLC neuroendocrine transcriptional programs.
1288	8936524	BODY61	CONCLUSIONS	233	Epigenetic plasticity is known to contribute to the poor durability of responses of SCLC to current therapies as selection of mesenchymal enriched clones become enriched in refractory disease found in relapse [50, 51].
1289	8936524	BODY61	CONCLUSIONS	234	Many SCLC cell lines analyzed in this study show either no response or only partial response to LSD1 inhibitors even after 21 days of treatment, suggesting many SCLC cell lines either have a preexisting drug‐resistant population or are capable of transitioning to a drug‐resistant state.
1290	8936524	BODY61	CONCLUSIONS	235	Experimentally neuroendocrine SCLC cell lines can transition from neuroendocrine into mesenchymal phenotypes when treated with targeted or chemotherapies [19, 44, 45, 50].
1291	8936524	BODY61	CONCLUSIONS	236	This observation is clinically relevant as SCLC tumors are often composed of epigenetically heterogeneous cells with either a neuroendocrine or a mesenchymal profile [18, 19, 50].
1292	8936524	BODY62	CONCLUSIONS	237	Despite early literature suggesting LSD1 inhibitors would be broadly active in numerous cancers including colon, prostate, and breast cancer [12, 52, 53], the generation of more selective LSD1 inhibitors has clarified the extent of LSD1 inhibitor activity primarily in AML and SCLC [5, 54].
1293	8936524	BODY62	CONCLUSIONS	238	One possible explanation for this discrepancy is suggested from the recent reports identifying noncatalytic mechanisms of action of current LSD1 inhibitors being explored in the clinic.
1294	8936524	BODY62	CONCLUSIONS	239	Inhibition of the interaction of LSD1 with SNAG domain‐containing proteins INSM1 or GFI1B impacts expression of key neuroendocrine lineage transcriptional regulators in SCLC including ASCL1 [15].
1295	8936524	BODY62	CONCLUSIONS	240	Recently, a specific inhibitor of LSD1 enzyme activity has been discovered, T‐448 [55], which has minimal impact on the interaction of the LSD1‐CoRest complex with SNAG domain transcription factors.
1296	8936524	BODY62	CONCLUSIONS	241	In our studies, T‐448 has no antiproliferative effect on NCI‐H69 cells after 21‐day treatment (Fig. S11), suggesting that the mechanism of action of LSD inhibitors occurs primarily through disruption of the interaction of LSD1 with SNAG domain transcription factors.
1297	8936524	BODY62	CONCLUSIONS	242	Our data demonstrate that all cell lines sensitive to LSD1 inhibitors express either INSM1 or GFI1B; however, a subset of cell lines resistant to the drug also express these genes.
1298	8936524	BODY62	CONCLUSIONS	243	Thus, the expression of these SNAG domain‐containing proteins alone does not predict sensitivity to LSD1 inhibitors.
1299	8936524	BODY62	CONCLUSIONS	244	Interestingly, LSD1 has been found to interact with the SNAG domain of SNAIL and implicated in the transcriptional repression of epithelial markers during EMT transition in breast cancer cells [56].
1300	8936524	BODY62	CONCLUSIONS	245	The role of LSD1 in the SNAG domain of targeted proteins appears to be context and lineage specific.
1301	8936524	BODY63	CONCLUSIONS	246	Our results demonstrate that SCLC cells which have evolved non‐neuroendocrine, mesenchymal‐like transcriptional programs are resistant to LSD1 inhibition.
1302	8936524	BODY63	CONCLUSIONS	247	These findings are consistent with Mohammad et al., [5] who identified TGF‐beta pathway signatures negatively correlate with LSD1 inhibitor sensitivity in SCLC.
1303	8936524	BODY63	CONCLUSIONS	248	The TGF‐beta pathway is known to regulate EMT pathways in cancer as well as in normal development [46].
1304	8936524	BODY63	CONCLUSIONS	249	In cell lines sensitive to LSD1 inhibitors, we did observe enrichment for TGF‐beta pathway genes as well as genes involved in axonal and EMT pathways after LSD1 inhibitor treatment.
1305	8936524	BODY63	CONCLUSIONS	250	Therefore, these data are potentially consistent with our observation that neuroendocrine and mesenchymal differentiation markers stratify sensitivity of SCLC cell lines to LSD1 inhibitors.
1306	8936524	BODY63	CONCLUSIONS	251	Augert et al.
1307	8936524	BODY63	CONCLUSIONS	252	also identified heterogeneous responses to the LSD1 inhibitor ORY‐1001 in a screen of SCLC patient‐derived xenograft (PDX) models [13].
1308	8936524	BODY63	CONCLUSIONS	253	In their study, PDX models capable of NOTCH activation and concomitant ASCL1 downregulation were enriched in response to LSD1 inhibition.
1309	8936524	BODY63	CONCLUSIONS	254	In gene expression studies following GSK690 treatment, we did observe induction of NOTCH pathway genes in COR‐L88 and NCI‐H1417 cells but not to the same extent in NCI‐H69 or NCI‐H889 cells.
1310	8936524	BODY63	CONCLUSIONS	255	This suggests that NOTCH pathway‐independent mechanisms of LSD1 inhibitor response exist in SCLC.
1311	8936524	BODY64	CONCLUSIONS	256	This study highlights the remarkable plasticity of SCLC to evolve into drug‐resistant mesenchymal‐like states.
1312	8936524	BODY64	CONCLUSIONS	257	Along these lines, we found expression of the neuroendocrine transcription factor ASCL1 was downregulated after GSK690 treatment in most models with the exception of NCI‐H526 cells which shows a very low expression level of ASCL1 and is reported that the interaction between LSD1 and SNAG domain protein GFI1B plays a key role in this cell line [15].
1313	8936524	BODY64	CONCLUSIONS	258	The extent of mesenchymal gene induction in GSK690‐treated SCLC cells does appear comparatively lower relative to what we observed in mesenchymal‐shifted NCI‐H69V cells and thus may represent a ‘partial EMT’ [47].
1314	8936524	BODY64	CONCLUSIONS	259	In support of this model, drug washout experiments suggest these changes are ‘epi‐stable’ as cells revert to neuroendocrine phenotypes within 7 days of drug removal.
1315	8936524	BODY64	CONCLUSIONS	260	Additionally, we found many SCLC cell lines analyzed in this study show only partial response to LSD1 inhibitors even after 21 days of treatment, suggesting many SCLC cell lines are capable of transitioning to a drug‐resistant state.
1316	8936524	BODY64	CONCLUSIONS	261	Single cell RNA‐seq suggests that this resistant population likely represents an acquired drug‐tolerant state represented by transcriptional reprogramming that is maintained under drug selection.
1317	8936524	BODY64	CONCLUSIONS	262	Consistent with this finding, ATAC‐seq data in NCI‐H69 cells highlighted a shift in the utilization of transcription factors from ASCL1 to TEAD4 in drug‐resistant cells.
1318	8936524	BODY64	CONCLUSIONS	263	Interestingly, the expression of TEAD4 and downstream YAP and TAZ have recently been highlighted to represent a unique subtype of non‐ASCL1‐driven SCLC [48].
1319	8936524	BODY64	CONCLUSIONS	264	Our data suggest that inhibiting TEAD transcriptional activity may be an effective strategy to prevent the acquired resistance of SCLC in response to LSD1 inhibitors.
1320	8936524	BODY65	CONCLUSIONS	265	A recent phase I study of GSK2879552 in relapsed or refractory SCLC found a disease control rate of 14% (four of 29 patients) [57].
1321	8936524	BODY65	CONCLUSIONS	266	High rates of adverse events, including thrombocytopenia and encephalopathy, lead to the termination of the study.
1322	8936524	BODY65	CONCLUSIONS	267	Our data suggest that only a segment of SCLC patients, with a defined neuroendocrine differentiation state, will likely benefit from LSD1 inhibitors.
1323	8936524	BODY65	CONCLUSIONS	268	In LSD1 inhibitor‐treated patients, a mesenchymal‐like resistant population is likely to persist.
1324	8936524	BODY65	CONCLUSIONS	269	Thus, emphasis should focus on drug combination approaches that can sustain clinical responses by eliminating cells that maintain residual disease.
1325	8936524	BODY65	CONCLUSIONS	270	Experimentally, it has been demonstrated that SCLC cells treated with chemotherapy [50] or radiotherapy [58] obtain mesenchymal characteristics that confer drug resistance.
1326	8936524	BODY65	CONCLUSIONS	271	Thus, the efficacy of LSD1 inhibitors in SCLC patients heavily pretreated with chemotherapy will be an important consideration.
1327	8936524	BODY65	CONCLUSIONS	272	The recent disclosures of additional LSD1 inhibitors, IMG‐7289, INCB059872, and CC‐90011, under clinical development for SCLC highlight the importance of clarifying the mechanism of action as well as further defining the clinical application of these drugs [6].
1328	8936524	BODY66	CONCLUSIONS	273	We discovered that epigenetic plasticity contributes to heterogeneous responsiveness of SCLC to LSD1 inhibitors.
1329	8936524	BODY66	CONCLUSIONS	274	Sensitivity to LSD1 inhibitors in SCLC is confined primarily to cells that express neuroendocrine transcriptional programs.
1330	8936524	BODY66	CONCLUSIONS	275	Selection of a TEAD4‐driven mesenchymal‐like subpopulation is likely to present a barrier to effective single‐agent responses in the clinic.
1331	8936524	BODY66	CONCLUSIONS	276	Drug combinations targeting the YAP‐TEAD pathways in combination with LSD1 inhibitors may be an effective strategy to target intrinsic and adaptive mesenchymal‐like resistant populations and sustain effective clinical responses.
1332	8936524	BODY69	CONCLUSIONS	277	The peer review history for this article is available at https://publons.com/publon/10.1002/1878‐0261.13124.
1333	9722452	TITLE	TITLE	0	DLL3 regulates Notch signaling in small cell lung cancer
1334	9722452	ABS0	ABSTRACT	1	Tumor heterogeneity plays a critical role in tumor development and response to treatment.
1335	9722452	ABS0	ABSTRACT	2	In small-cell lung cancer (SCLC), intratumoral heterogeneity is driven in part by the Notch signaling pathway, which reprograms neuroendocrine cancer cells to a less/non-neuroendocrine state.
1336	9722452	ABS0	ABSTRACT	3	Here we investigated the atypical Notch ligand DLL3 as a biomarker of the neuroendocrine state and a regulator of cell-cell interactions in SCLC.
1337	9722452	ABS0	ABSTRACT	4	We first built a mathematical model to predict the impact of DLL3 expression on SCLC cell populations.
1338	9722452	ABS0	ABSTRACT	5	We next tested this model using a single-chain variable fragment (scFv) to track DLL3 expression in vivo and a new mouse model of SCLC with inducible expression of DLL3 in SCLC tumors.
1339	9722452	ABS0	ABSTRACT	6	We found that high levels of DLL3 promote the expansion of a SCLC cell population with lower expression levels of both neuroendocrine and non-neuroendocrine markers.
1340	9722452	ABS0	ABSTRACT	7	This work may influence how DLL3-targeting therapies are used in SCLC patients.
1341	9722452	ABS1	ABSTRACT	8	 •
1342	9722452	ABS1	ABSTRACT	9	 Ectopic expression of DLL3 suppresses Notch signaling in SCLC cells
1343	9722452	ABS1	ABSTRACT	10	 •
1344	9722452	ABS1	ABSTRACT	11	 Lateral inhibition model predicts expression level-dependent effects of DLL3
1345	9722452	ABS1	ABSTRACT	12	 •
1346	9722452	ABS1	ABSTRACT	13	 Anti-DLL3 scFv labels SCLC cells in vitro and in vivo
1347	9722452	ABS1	ABSTRACT	14	 •
1348	9722452	ABS1	ABSTRACT	15	 DLL3 expression prevents cell-fate bifurcation in mouse model of SCLC
1349	9722452	ABS2	ABSTRACT	16	Ectopic expression of DLL3 suppresses Notch signaling in SCLC cells
1350	9722452	ABS3	ABSTRACT	17	Lateral inhibition model predicts expression level-dependent effects of DLL3
1351	9722452	ABS4	ABSTRACT	18	Anti-DLL3 scFv labels SCLC cells in vitro and in vivo
1352	9722452	ABS5	ABSTRACT	19	DLL3 expression prevents cell-fate bifurcation in mouse model of SCLC
1353	9722452	ABS6	ABSTRACT	20	Molecular biology; Cancer; In silico biology
1354	9722452	BODY0	BACKGROUND	21	Tumors consist of a variety of cancer and non-cancer cells.
1355	9722452	BODY0	BACKGROUND	22	Both cancer cells and non-cancer cells in the tumor microenvironment display various levels of heterogeneity.
1356	9722452	BODY0	BACKGROUND	23	This heterogeneity may vary over time and environmental conditions, and it plays an important role in tumor development, including shaping the natural response of tumors to the immune system or treatment in the clinic (reviewed in1,2,3,4).
1357	9722452	BODY1	BACKGROUND	24	SCLC is an aggressive subtype of lung cancer with fast growth rates and a striking metastatic ability.
1358	9722452	BODY1	BACKGROUND	25	The median overall survival of SCLC patients has remained close to 8–10 months in the past 3 decades, with a 5-year survival at ∼6% and over 200,000 estimated deaths worldwide every year.
1359	9722452	BODY1	BACKGROUND	26	Most tumors respond well initially to standard-of-care chemoradiation treatment, but resistance emerges rapidly in nearly all cases (reviewed in5).
1360	9722452	BODY1	BACKGROUND	27	The recent approval of T cell immune checkpoint inhibitors has been beneficial to only a small fraction of SCLC patients (reviewed in6).
1361	9722452	BODY1	BACKGROUND	28	There is a critical need to develop biomarkers for SCLC development and more efficient therapeutic strategies.
1362	9722452	BODY2	BACKGROUND	29	SCLC tumors harbor few non-cancer cells7 but inter- and intratumoral heterogeneity is still a prominent feature of these tumors.
1363	9722452	BODY2	BACKGROUND	30	At the epigenetic/transcriptional level, SCLC tumors have been classified into different subtypes based on transcriptional programs driven by specific transcription factors in cancer cell populations, with the SCLC-A (expressing the ASCL1 transcription factor) and SCLC-N (expressing the NEUROD1 transcription factor) neuroendocrine subtypes being the most frequent in patients.8,9,10 Importantly, mounting evidence indicates that individual SCLC tumors are comprising heterogeneous populations of cancer cells with different levels of neuroendocrine gene programs.11,12,13 As an example of this intratumoral heterogeneity, in SCLC-A tumors, activation of Notch signaling can reprogram neuroendocrine (NE) cancer cells toward less/non-neuroendocrine (non-NE) phenotypes.12 The non-NE cells are less tumorigenic and genetic and pharmacologic approaches to promote NE to non-NE differentiation have been shown to decrease SCLC tumor growth.14 But non-NE can support the survival of the NE cells, including when tumors are treated with chemotherapy.12,15 In this context, the mechanisms activating Notch signaling are not completely understood, but may depend on the YAP transcriptional regulator.16 As another example, in SCLC-N tumors, expression of c-MYC can activate Notch signaling, which also promotes the transition of these tumors to a less neuroendocrine phenotype.17 These data and data from human tumors indicate that both inter- and intratumoral heterogeneity are likely key contributors of the ability of SCLC tumors to become resistant to therapies.8,18,19
1364	9722452	BODY3	BACKGROUND	31	DLL3 (Delta-like ligand 3) is an atypical ligand for NOTCH receptors initially studied for its role in early pattern formation in mouse embryos.20,21,22 Early work showed that DLL3 does not activate Notch signaling but rather functions as an inhibitor of Notch signaling in a cell autonomous manner,23 possibly in a cis-inhibition mechanism in the Golgi.24,25 However, genetic studies of DLL3 O-fucosylation indicate that interactions with NOTCH may not fully account for the physiological function of DLL3, suggesting possible Notch-independent roles for DLL3 in vivo.26 The mouse Dll3 gene is a direct target of ASCL127 and DLL3 is expressed in a significant number of human SCLC tumors.
1365	9722452	BODY3	BACKGROUND	32	Importantly, Saunders and colleagues showed that DLL3 is present at the surface of SCLC cells and that targeting DLL3-expressing SCLC cells using an antibody-drug conjugate (ADC) can eradicate SCLC in pre-clinical models.28 Clinical trials using Rovalpituzumab tesirine (Rova-T), an ADC targeting DLL3, have been unsuccessful largely because of toxic side effects of this molecule (e.g.,29,30,31).
1366	9722452	BODY3	BACKGROUND	33	However, other strategies are being developed to target DLL3 expressing cells, (e.g.,32,33,34,35) and DLL3 remains a target of interest for detection and treatment of SCLC.
1367	9722452	BODY4	BACKGROUND	34	Here we developed tools and models to further investigate the role of DLL3 as a biomarker of SCLC and as a regulator of Notch signaling in SCLC.
