	PMCID	id	sectype	sentenceid	text
1982	6942053	BODY44	METHODS	208	A homologous recombination reaction was then performed using LR Clonase II (Life Technologies #11791100) with the pENTR223-NOTCH2-ICD vector and a DOX-On pTripZ vector that was modified to be used as a destination vector for recombination cloning.
1983	6942053	BODY44	METHODS	209	The reaction was transformed into XL-10 Gold ultracompetent cells.
1984	6942053	BODY44	METHODS	210	Kanamycin-resistant colonies were screened by restriction digestion of miniprep DNA and subsequently validated by DNA sequencing.
1985	6942053	BODY45	METHODS	211	To make lentiviral vectors for DOX-inducible exogenous ASCL1 expression (pTripZ-EV and pTripZ-ASCL1-3XFLAG), homologous recombination reactions between pENTR223 ASCL1 or pENTR223 EV and a modified pTripZ-NEO destination vector were performed using LR Clonase II.
1986	6942053	BODY45	METHODS	212	The reaction mixture was transformed into HB101 competent cells (Promega).
1987	6942053	BODY45	METHODS	213	Kanamycin-resistant colonies were screened by restriction digestion of miniprep DNA and subsequently validated by DNA sequencing.
1988	6942053	BODY46	METHODS	214	To make lentiviral vectors for constitutive exogenous ASCL1 expression (pLenti-EF1α-EV and pLenti-EF1α-ASCL1-3XHA), homologous recombination reactions between pENTR223 ASCL1 or pENTR223 EV and the destination lentiviral vector pLenti-EF1α-gateway-3HA-PGK-Puromycin (a kind gift from Dr. Gang Lu) were performed using LR Clonase II.
1989	6942053	BODY46	METHODS	215	The reaction mixture was transformed into HB101 competent cells (Promega).
1990	6942053	BODY46	METHODS	216	Kanamycin-resistant colonies were screened by restriction digestion of miniprep DNA and subsequently validated by DNA sequencing.
1991	6942053	BODY47	METHODS	217	Lenti-Cas9-2A-Blast was purchased from Addgene (#73310).
1992	6942053	BODY48	METHODS	218	Lentiviruses were made by Lipofectamine 2000-based cotransfection of 293FT cells with the respective lentiviral expression vectors and the packaging plasmids psPAX2 (Addgene #12260) and pMD2.G (Addgene #12259) in a ratio of 4:3:1.
1993	6942053	BODY48	METHODS	219	Virus-containing supernatant was collected at 48 and 72 h after transfection, pooled together (15 mL total per 10-cm tissue culture dish), passed through a 0.45-µm filter, aliquoted, and frozen at −80°C until use.
1994	6942053	BODY49	METHODS	220	Suspension cells were counted using a Vi-Cell XR Cell Counter (Beckman Coulter) and resuspended in 1 mL lentivirus with 5 μg/mL polybrene at the following concentrations in individual wells of a 12-well plate: 1 × 106 cells/mL for NCI-H82 cells, or 2 × 106 cells/mL for NCI-H1876, GLC16, and NCI-H1417 cells.
1995	6942053	BODY49	METHODS	221	The plates were then centrifuged at 434g for 2 h at 30°C.
1996	6942053	BODY49	METHODS	222	; 12–16 h later the virus was removed and cells were grown for 72 h before being placed under drug selection.
1997	6942053	BODY49	METHODS	223	Cells were selected by growth in puromycin (1 μg/mL), blasticidin (10 μg/mL), or G418 (800 μg/mL) and maintained in media containing puromycin (1 μg/mL), blasticidin (10 μg/mL), or G418 (400 μg/mL), respectively.
1998	6942053	BODY50	METHODS	224	1 × 106 cells were centrifuged at 400g for 3 min at 4°C and the media was removed by gentle aspiration.
1999	6942053	BODY50	METHODS	225	The cell pellet was then washed once in 1 mL of ice-cold PBS, transferred to a 1.5-mL Eppendorf tube, and centrifuged at 400g for 3 min at 4°C.
2000	6942053	BODY50	METHODS	226	The PBS was carefully aspirated and the cell pellet was lysed in RBP2 lysis buffer (50 mM Tris Cl pH 7.5, 400 mM NaCl, 0.5% NP-40) supplemented with a protease inhibitor cocktail (Complete, Roche Applied Science, 11836153001) and phosphatase inhibitors (PhosSTOP Sigma #04906837001).
2001	6942053	BODY50	METHODS	227	Whole-cell extracts were quantified using the Bradford Protein Assay and 40 μg of protein per sample was boiled in sample buffer (3X is 6.7% SDS, 33% Glycerol, 300 mM DTT, and Bromophenol Blue), resolved bySDS-PAGE (6% SDS-PAGE for KDM5A, NOTCH, Rb1, and p130, 8% SDS-PAGE for Tp53, 10% SDS-PAGE for ASCL1, HES1, and Synaptophysin), transferred onto nitrocellulose membranes, blocked in 5% milk in Tris-Buffered Saline with 0.1% Tween 20 (TBS-T) for 1 h, and probed with the indicated primary antibodies overnight at 4°C.
2002	6942053	BODY50	METHODS	228	Membranes were then washed three times in TBS-T, probed with the indicated horseradish peroxidase-conjugated (HRP) secondary antibodies for 1 h at room temperature, and washed three times in TBS-T.
2003	6942053	BODY50	METHODS	229	Bound antibodies were detected with enhanced chemiluminescence (ECL) Western blotting detection reagents (Immobilon [Thermo Fisher Scientific, #WBKLS0500] or Supersignal West Pico [Thermo Fisher Scientific, #PI34078]).
2004	6942053	BODY50	METHODS	230	The primary antibodies used were: rabbit α-KDM5A (Cell Signaling #3876S, used at 1:1000), rabbit α-ASCL1 (Abcam Ab211327, used at 1:1000), rabbit α-NOTCH1 (Cell Signaling D1E11 #3608 used at 1:1000), rabbit α-Cleaved NOTCH1 (Cell Signaling D3B8 #4147 used at 1:1000), rabbit α-NOTCH2 (Cell Signaling D76A6 #5732 used at 1:1000), rabbit α-HES1 (Cell Signaling D6P2U #11988 used at 1:1000), mouse α-HA (HA.11, Covance), rabbit α-Rb1 (Abcam #181616 used at 1:2000), rabbit rodent- specific α-p53 (Cell Signaling D2H9O #32532 used at 1:1000), rabbit α-p130 (Abcam #76234 used at 1:1000), rabbit α-Synaptophysin (Abcam #32127 used at 1:10,000), rabbit α-Chromogranin A (Abcam #15160 used at 1:200), rabbit α-NEUROD (Cell Signaling #4373 used at 1:1000), mouse α-Vinculin (Sigma, hVIN-1, # V9131, used at 1:1000), mouse α-Tubulin (Sigma, B-5-1-2, # T5168, used at 1:5000), mouse α-FLAG (Sigma, clone M2, #F1804, used at 1:2000), and mouse α-β-actin (Sigma, clone AC-15, #A3854, used at 1:25,000).
2005	6942053	BODY50	METHODS	231	The HRP conjugated secondary antibodies were Goat α-Mouse (Pierce) and Goat α-Rabbit (Pierce) and were used at 1:5000.
2006	6942053	BODY51	METHODS	232	1 × 106 cells were pelleted by centrifugation at 400g for 3 min at 4°C in a 15-mL conical tube.
2007	6942053	BODY51	METHODS	233	The cell pellets were then washed once in 1 mL of ice cold PBS, transferred to a 1.5-mL Eppendorf tube, and pelleted by centrifugation at 400g for 3 min at 4°C.
2008	6942053	BODY51	METHODS	234	The PBS was removed by gentle aspiration and the soluble proteins from the cell pellets were extracted by incubation in Nucleus Lysis Buffer (250 mM Sucrose, 60 mM KCL, 15 nM NaCl, 15 mM Tris pH 7.5, 5 mM MgCl2, 1 mM CaCl2, 1 mM DTT, 0.3% NP-40 supplemented with a cocktail of protease inhibitor cocktail and phosphatase inhibitors) for 10 min at 4°C.
2009	6942053	BODY51	METHODS	235	The extracts were then centrifuged at 10,000g for 1 min at 4°C and the supernatant was removed by aspiration.
2010	6942053	BODY51	METHODS	236	The cell pellets were again resuspended in Nucleus Lysis Buffer and incubated for 10 min at 4°C and then centrifuged at 10,000g for 1 min at 4°C.
2011	6942053	BODY51	METHODS	237	The supernatant was removed by aspiration and the histones in the insoluble pellet were extracted by overnight incubation in 100 µL of 0.2 N HCl followed by centrifugation at 16,800g for 15 min at 4°C.
2012	6942053	BODY51	METHODS	238	The supernatant was transferred to a fresh 1.5-mL Eppendorf tube and quantified using the Bradford Protein Assay.
2013	6942053	BODY51	METHODS	239	The pH of the supernatant was neutralized by adding 1/5 volume of 1 N NaOH, as confirmed by the color of the samples after the addition of sample buffer containing Bromophenol Blue.
2014	6942053	BODY51	METHODS	240	A total of 1 μg of protein in sample buffer was boiled and resolved by SDS-PAGE on a 15% SDS–polyacrylamide gel.
2015	6942053	BODY51	METHODS	241	Immunoblot analysis was performed as described above.
2016	6942053	BODY51	METHODS	242	The primary antibodies used were rabbit α-Histone 3 (Cell Signaling, DH12, #4499), rabbit α-Tri Methyl-Histone H3 (Lys 4) (Cell Signaling C42D8 #9751 used at 1:1000), rabbit α-Tri Methyl-Histone H3 (Lys 27) (Cell Signaling C36B11 #9733 used at 1:1000), mouse α-Di/Tri Methyl-Histone H3 (Lys 9) (Cell Signaling 6F12 #5327 used at 1:1000).
2017	6942053	BODY51	METHODS	243	The secondary antibody was HRP-conjugated Goat α-Rabbit (Pierce).
2018	6942053	BODY52	METHODS	244	Cells were counted on day 0 using a Vi-Cell XR Cell Counter and plated in petri dishes at 100,000 cells/mL in 8 mL of media for GLC16 cells or at 32,500 cells/mL in 8 mL of media for NCI-H82 cells.
2019	6942053	BODY52	METHODS	245	NCI-H1876 cells were plated in tissue culture-treated 6-well plates at 500,000 cells/mL in 2 mL of media and NCI-H69 cells were plated at 200,000 cells/mL in 2 mL of media in such plates.
2020	6942053	BODY52	METHODS	246	For experiments involving KDM5-C70, fresh drug (KDM5-C70 or DMSO) was added to the cells every 3–4 d (as indicated) at the concentrations indicated.
2021	6942053	BODY52	METHODS	247	For the DOX-On inducible ASCL1 cDNA expression experiments, Doxycycline (2 µg/mL) was added to cells where indicated 48-h prior to treatment with KDM5-C70 and added to the fresh media each time the cells were passaged.
2022	6942053	BODY52	METHODS	248	Cells were passaged at 1:2 every 3-4 d with fresh media replacement, and cell counts were then determined using the Vi-Cell XR Cell Counter and normalized to day 0.
2023	6942053	BODY53	METHODS	249	GLC16, NCI-H1876, NCI-H69, or NCI-H1417 cells were counted on day 0 using a Vi-Cell XR Cell Counter and plated in tissue culture-treated dishes at 200,000 cells/mL.
2024	6942053	BODY53	METHODS	250	The cells were passaged at 1:2 every 3 d (with fresh media replacement) and harvested for immunoblot analysis at the times indicated after treatment with KDM5-C70 or infection with lentiviruses expressing sgRNAs targeting KDM5A.
2025	6942053	BODY54	METHODS	251	NCI-H69 cells were counted on day 0 using a Vi-Cell XR Cell Counter and plated in tissue-culture-treated 6-well plates at 200 cells/mL in 2 mL with the indicated concentration of KDM5-C70.
2026	6942053	BODY54	METHODS	252	The cells were passaged at 1:2 every 3 d (with fresh media replacement containing KDM5C-70).
2027	6942053	BODY55	METHODS	253	Floating cells from mouse SCLC cell lines (#703, #631, #38 12, #38 13, #38 2) were counted on day 0 using a Vi-Cell XR Cell Counter and plated in tissue culture-treated 6-well plates at 400 cells/mL in 2 mL media.
2028	6942053	BODY55	METHODS	254	Ninety-six hours later the cells were washed twice in PBS to remove nonadherent cells.
2029	6942053	BODY55	METHODS	255	Representative images were acquired using brightfield microscopy with a 10× objective and then stained with crystal violet for visualization of the entire well.
2030	6942053	BODY56	METHODS	256	GLC16, NCI-H1876, or NCI-H69 cells were plated at 200,000 cells/mL on a tissue-culture dish and treated with the indicated concentrations of KDM5-C70 for 72 h. Histones were extracted (see Materials and Methods) and immunoblotted for the indicated antibodies recognizing specific histone methylation marks.
2031	6942053	BODY57	METHODS	257	NCI-H82 cells expressing Cas9 were first infected with pLL3.7-EF1α-KDM5A WT 3X HA, selected with G418, and then superinfected lentiviruses expressing an sgRNA targeting KDM5A (sgKDM5A #2) or a nontargeting sgRNA (control sgRNA).
2032	6942053	BODY57	METHODS	258	sgKDM5A #2 targets an intron-exon boundary of the genomic DNA sequence of KDM5A and therefore is inherently resistant to the KDM5A cDNA expression vector.
2033	6942053	BODY57	METHODS	259	Puromycin-resistant cells, indicative of successful infection with the sgRNA lentiviruses, were counted using the Vi-Cell XR Cell and proliferation assays were performed as described above for NCI-H82 cells.
2034	6942053	BODY58	METHODS	260	GLC16 cells expressing Cas9 were first infected with pLentiCRISPR-Neomycin lentivirus encoding a Neomycin-resistance gene, and an sgRNA targeting NOTCH2 (sgNOTCH2 #1) or a nontargeting sgRNA (control sgRNA).
2035	6942053	BODY58	METHODS	261	The Neomycin-resistant cells were selected with G418.
2036	6942053	BODY58	METHODS	262	Neomycin-resistant cells were then superinfected with pLentiCRISPR-puromycin lentivirus encoding a puromycin-resistance gene, and an sgRNA targeting KDM5A (sgKDM5A #1) or a nontargeting sgRNA (control sgRNA).
2037	6942053	BODY58	METHODS	263	Following selection with puromycin, the cells were counted using a Vi-Cell XR Cell and plated at 200,000 cells/mL.
2038	6942053	BODY58	METHODS	264	Cells were harvested for immunoblot analysis at the times indicated.
2039	6942053	BODY59	METHODS	265	NCI-H69 cells or NCI-H1876 cells were counted on day 0 using a Vi-Cell XR Cell Counter and plated in tissue culture-treated 6-well plates at 200,000 cells/mL (for NCI-H69 cells) or 250,000 cells/mL (for NCI-H1876 cells) in 2 mL with the indicated concentrations of KDM5-C70 or ORY-1001 or both.
2040	6942053	BODY59	METHODS	266	For NCI-H69 cells, the cells were passaged at 1:2 every 3 d (with fresh media replacement containing KDM5C-70 or ORY-1001 or both).
2041	6942053	BODY59	METHODS	267	For NCI-H1876 cells, fresh media was replaced (containing KDM5-C70 or ORY-1001 or both) every 4 d. Coefficient of drug interaction (CDI) was calculated by using the following formula: CDI = AB/(A × B), where AB = cell count after combined treatment with KDM5-C70 and ORY-1001, A = cell count after KDM5-C70 treatment alone, and B = cell count after ORY-1001 treatment alone.
2042	6942053	BODY60	METHODS	268	For KDM5-C70 dose response assays in Supplemental Figure 1E–H, cells were counted on D0 using a Vi-Cell XR Cell Counter and plated at the following densities with the indicated concentrations of KDM5-C70: 100,000 cells/mL in 2 mL in a 6-well plate for SCLC cell lines (NCI-H69, NCI-H2081, GLC16, CORL47, CORL279, NCI-H82, NCI-H1694, NCI-H1876, and NCI-H446 cells) and 10,000 cells/mL in 2 mL in a 6-well plate for NSCLC cell lines (A549, NCI-H1650, NCI-H1975, and PC-9 cells).
2043	6942053	BODY60	METHODS	269	On day 5, all cell lines were passaged [1:2 for all SCLC cell lines, except for NCI-H1876 cells (which only required fresh media) and NCI-H446 cells (passaged at 1:5), and 1:10 for all NSCLC cell lines], and replaced with fresh media containing KDM5-C70.
2044	6942053	BODY60	METHODS	270	All cells were counted on day 10 using a Vi-Cell XR Cell Counter.
2045	6942053	BODY61	METHODS	271	For the sgKDM5A RNA sequencing experiment, GLC16 cells expressing Cas9 were infected with a lentivirus (plentiGuide-Puro) encoding sgKDM5A #1 or a nontargeting sgRNA (sgControl) and selected with puromycin.
2046	6942053	BODY61	METHODS	272	On day 11, cells were counted using Vi-Cell XR Cell Counter and plated at 200,000 cells/mL in 8 mL of complete media.
2047	6942053	BODY61	METHODS	273	Cells were harvested for RNA 72 h later (day 14 after infection).
2048	6942053	BODY61	METHODS	274	RNA was extracted using RNeasy mini kit (Qiagen #74106) and RNA sequencing was performed.
2049	6942053	BODY62	METHODS	275	For the NOTCH2-ICD overexpression RNA sequencing experiment, GLC16 pTripZ NOTCH2-ICD cells were plated at 200,000 cells/mL in 8 mL of complete media on tissue culture-treated dishes and grown in the presence or absence of DOX (at 1 μg/mL) for 72 h. RNA was extracted using RNeasy mini kit and RNA sequencing was performed.
2050	6942053	BODY63	METHODS	276	For the RNA sequencing experiment using the SCLC tumors derived from the CRISPR-based SCLC GEMM, tumors were harvested at necropsy and were flash-frozen.
2051	6942053	BODY63	METHODS	277	RNA was extracted using RNeasy mini kit and RNA sequencing was performed.
2052	6942053	BODY64	METHODS	278	Libraries were prepared using Illumina TruSeq stranded mRNA sample preparation kits from 500 ng of purified total RNA according to the manufacturer's protocol.
2053	6942053	BODY64	METHODS	279	The finished dsDNA libraries were quantified by Qubit fluorometer, Agilent TapeStation 2200, and RT-qPCR using the Kapa Biosystems library quantification kit according to manufacturer's protocols.
2054	6942053	BODY64	METHODS	280	Uniquely indexed libraries were pooled in equimolar ratios and sequenced on an Illumina NextSeq500 with single-end 75-bp reads by the Dana-Farber Cancer Institute Molecular Biology Core Facilities.
2055	6942053	BODY65	METHODS	281	Sequenced reads were aligned to the UCSC hg19 human reference or UCSC mm9 mouse reference genome assembly and gene counts were quantified using STAR (v2.5.1b).
2056	6942053	BODY65	METHODS	282	Differential expression testing was performed by DESeq2 (v1.10.1) as part of the VIPER analysis pipeline (https://bitbucket.org/cfce/viper/).
2057	6942053	BODY65	METHODS	283	Normalized read counts (RPKM) were calculated using cufflinks (v2.2.1).
2058	6942053	BODY66	METHODS	284	For gene set enrichment analysis (GSEA), software was downloaded from the Gene Set Enrichment Analysis website (http://www.broad.mit.edu/gsea/downloads.jsp).
2059	6942053	BODY66	METHODS	285	GSEA was performed using the “Gene-Ontology” or “Hallmark” gene sets for identification of enriched/depleted signatures.
2060	6942053	BODY66	METHODS	286	Gene Sets with an FDR < 0.25 and a nominal P-value of <0.05 were considered significant.
2061	6942053	BODY67	METHODS	287	RNA was extracted using RNeasy mini kit (Qiagen #74106) according to the manufacturer's instructions.
2062	6942053	BODY67	METHODS	288	RNA concentration was determined using the Nanodrop 8000 (Thermofisher Scientific).
2063	6942053	BODY67	METHODS	289	A cDNA library was synthesized using AffinityScript QPCR cDNA Synthesis Kit (Agilent #600559) according to the manufacturer's instructions by use of Random Primers.
2064	6942053	BODY67	METHODS	290	qPCR was performed using the LightCycler 480 (Roche) with the LightCycler 480 Probes Master Kit (Roche) and Taqman probes (ThermoFisher Scientific) according to the manufacturer's instructions.
2065	6942053	BODY67	METHODS	291	The ΔΔCT Method was used to analyze data.
2066	6942053	BODY67	METHODS	292	The CT values for each probe were then normalized to the CT value of ACTB for that sample.
2067	6942053	BODY67	METHODS	293	The data from each experiment was then normalized to the control to determine the relative fold change in mRNA expression.
2068	6942053	BODY67	METHODS	294	The following TaqMan probes were used: ASCL1 human (Hs04187546_g1), ACTB human (Hs01060665_m1), HES1 human (Hs00172878_m1), HEY1 human (Hs01114113_m1), NOTCH2 human (Hs01050724_m1), Actb mouse (Mm00607939_s1), Dlk1 mouse (Mm00494477_m1), and Nell1 mouse (Mm00616857_m1).
2069	6942053	BODY68	METHODS	295	ChIP-seq analysis was performed using GLC16 cells and NCI-H1876 SCLC cell lines.
2070	6942053	BODY68	METHODS	296	Briefly, GLC16 cells were plated at 0.2 × 106 cells/mL in 20 mL of complete media.
2071	6942053	BODY68	METHODS	297	NCI-H1876 cells were plated at 1 × 106 cells/mL in 20 mL of complete media.
2072	6942053	BODY68	METHODS	298	Forty-eight hours after plating, media was removed by aspiration and the cells were washed once in PBS at room temperature.
2073	6942053	BODY68	METHODS	299	The cells were then cross-linked by incubation with 2 mM disuccinimidyl glutarate (DSG) with rocking for 30 min at room temperature.
2074	6942053	BODY68	METHODS	300	The DSG was removed and the cells were fixed in 1% paraformaldehyde diluted in PBS for 10 min at 37°C.
2075	6942053	BODY68	METHODS	301	Excess formaldehyde was quenched by dropwise addition of Glycine to a final concentration 125 mM.
2076	6942053	BODY68	METHODS	302	The cells were then rocked for an additional 5 min at room temperature.
2077	6942053	BODY68	METHODS	303	The paraformaldehyde/glycine was then removed and the cells were washed once with ice cold PBS.
2078	6942053	BODY68	METHODS	304	A total of 5 mL of ice-cold PBS was added to the cells and the cells were removed by scraping.
2079	6942053	BODY69	METHODS	305	The cells were centrifuged at 3000g for 5 min and resuspended in 3 mL of lysis buffer (50 mM Hepes-NaOH pH 8, 140 mM NaCl, 1 mM EDTA, 10% glycerol, 0.5% NP-40, 0.25% TX-100 supplemented with a protease inhibitor cocktail and phosphatase inhibitors) and incubated while rotating for 10 min at 4°C.
2080	6942053	BODY69	METHODS	306	Intact nuclei were then collected by centrifugation in an Eppendorf microcentrifuge at 4500 rpm for 5 min at 4°C.
2081	6942053	BODY69	METHODS	307	The supernatant was then gently aspirated and the pellet was resuspended in 1 mL of wash buffer (10 mM Tris-HCl pH 8.0, 200 mM NaCl, 1 mM EDTA, supplemented with a protease inhibitor cocktail and phosphatase inhibitors) and incubated while rotating for 10 min at 4°C.
2082	6942053	BODY69	METHODS	308	The nuclei were again collected by centrifugation in an Eppendorf microcentrifuge at 4500 rpm for 5 min at 4°C.
2083	6942053	BODY69	METHODS	309	The supernatant was then aspirated and the tube was rinsed with 0.5 mL of shearing buffer (0.1% SDS, 1 mM EDTA, 10 mM Tris-HCl pH 8.0 supplemented with a protease inhibitor cocktail and phosphatase inhibitors).
2084	6942053	BODY69	METHODS	310	The nuclei were again collected by centrifugation in an Eppendorf microcentrifuge at 4500 rpm for 5 min at 4°C, the supernatant was carefully removed, and the pellet was resuspended in 1 mL shearing buffer and transferred to a 1 mL AFA tube (Covaris #520130).
2085	6942053	BODY70	METHODS	311	The chromatin was then sonicated using a Covaris E220 sonicator at 100 peak incident power, 10% duty cycles, 200 cycles per burst, water level 8 for 900 sec.
2086	6942053	BODY70	METHODS	312	The samples were then transferred to 1.5-mL Eppendorf tubes and centrifuged in an Eppendorf microcentrifuge at 13,000 rpm for 5 min at 4°C.
2087	6942053	BODY70	METHODS	313	0.9 mL of the supernatants were transferred to a new Eppendorf tube, to which was added TX-100 (final concentration of 1%) and NaCl (final concentration of 150 mM).
2088	6942053	BODY71	METHODS	314	A total of 20 µL of Dynabeads Protein G (ThermoFisher #10004D) was then added and samples were rotated for 1 h at 4°C.
2089	6942053	BODY71	METHODS	315	The Dynabeads were then removed using a magnetic stand and the supernatants were transferred to new tubes.
2090	6942053	BODY71	METHODS	316	Five percent of the total was removed to be used as the input.
2091	6942053	BODY71	METHODS	317	One microgram of rabbit polyclonal anti-KDM5A antibody (Abcam, #ab70892) was added and the samples were incubated overnight while rotating at 4°C.
2092	6942053	BODY71	METHODS	318	The following morning, A total of 50 µL of Dynabeads Protein G were added and the samples were incubated for another 2 h while rotating at 4°C.
2093	6942053	BODY71	METHODS	319	A magnetic stand was used to pellet the Dynabeads.
2094	6942053	BODY71	METHODS	320	The supernatant was removed and the Dynabeads were washed once in 1 mL of low-salt immune complex wash buffer (20 mM Tris-HCl pH 8.0, 150 mM NaCl, 0.1% SDS, 1% TX-100, 2 mM EDTA) and incubated for 5 min while rotating at 4°C.
2095	6942053	BODY71	METHODS	321	The beads were again pelleted using a magnetic stand.
2096	6942053	BODY71	METHODS	322	Following removal of the supernatant, the Dynabeads were washed once in 1 mL of high-salt immune complex wash buffer (20 mM Tris-HCl pH 8.0, 500 mM NaCl, 0.1% SDS, 1% TX-100, 2 mM EDTA) and incubated for 5 min while rotating at 4°C.
2097	6942053	BODY71	METHODS	323	The beads were again pelleted with a magnetic stand.
2098	6942053	BODY71	METHODS	324	Following removal of the supernatant the Dynabeads were washed once in 1 mL of Lithium Chloride wash buffer (10 mM Tris-HCl pH 8.0, 250 mM LiCl, 1% SDS, 1% NP-40, 1 mM EDTA) and incubated for 5 min while rotating at 4°C.
2099	6942053	BODY71	METHODS	325	The beads were then washed twice in TE (pH 8) at room temperature and the beads were then resuspended in 100 µL TE (pH 8).
2100	6942053	BODY72	METHODS	326	RNase A was then added to a final concentration of 0.2 mg/mL and the samples were incubated for 30 min at 37°C.
2101	6942053	BODY72	METHODS	327	To reverse the crosslinking, proteinase K was then added to a final concentration of 0.8 mg/mL and the samples were incubated for 30 min at 42°C and then an additional 8 h at 65°C.
2102	6942053	BODY72	METHODS	328	A total of 300 µL QG buffer and 100 µL of isopropanol was then added to each sample and a magnetic stand was used to pellet the Dynabeads.
2103	6942053	BODY72	METHODS	329	The supernatant was then collected and DNA was isolated using QIAquick gel extraction kit (Qiagen) according to the manufacturer's instructions.
2104	6942053	BODY73	METHODS	330	Recovered DNA was quantified by Qubit and sequencing libraries were prepared using the Rubicon Genomics Thruplex-DNAseq sample preparation kits from 2 ng of the immunoprecipitated DNA according to manufacturer's protocol.
2105	6942053	BODY73	METHODS	331	The resultant ChIPseq libraries were quantified by Qubit fluorometer, Agilent TapeStation 2200, and RT-qPCR using the Kapa Biosystems library quantification kit according to manufacturer's protocols.
2106	6942053	BODY73	METHODS	332	Uniquely indexed libraries were pooled in equimolar ratios and sequenced on a single Illumina NextSeq500 run with single-end 75-bp reads by the Dana-Farber Cancer Institute Molecular Biology Core Facilities.
2107	6942053	BODY74	METHODS	333	ChIP-seq reads generated from KDM5A libraries were aligned to the Human genome (hg19) using the Burrows-Wheeler Aligner (BWA) (Li and Durbin 2010).
2108	6942053	BODY74	METHODS	334	KDM5A ChIP and Input tag densities were calculated using the R package SPP (Kharchenko et al. 2008) with a Gaussian kernel bandwidth of 35 bp.
2109	6942053	BODY74	METHODS	335	Enrichment of KDM5A relative to input was determined and peaks were called using the SPP function “get.broad.enrichment.clusters” with a Z-score threshold of three and a window size of 1000 bp.
